{
  "episodes": [
    {
      "audio": {
        "analyzedBytes": 68415319,
        "declaredBytes": 68415319,
        "enclosureUrl": "https://anchor.fm/s/1112097e0/podcast/play/121985970/https%3A%2F%2Fd3ctxlq1ktw2nl.cloudfront.net%2Fstaging%2F2026-5-30%2F427080450-44100-2-9187803669357.mp3",
        "sha256": "6d889490d951e8c2fe57f5ab32cc67f10148bdf67a19932384c8e4479a2e75e6"
      },
      "description": "We've spent six figures in tokens testing OpenAI's 5.6 Sol model to see whether if its better than Fable and what OpenAI have done to make it even better than 5.5. Also, we breakdown why we both moved our agents to Linux boxes, how to actually burn $65k on a single loop, and the Codex vs Claude Code subagent gap that's now bigger than the model gap itself. Thanks to this episode's sponsors Clerk and General Translation: Clerk, the auth platform with the best DX: https://nerdsnipe.link/clerk General Translation: https://nerdsnipe.link/gt Sources Available on our Substack: https://nerdsnipe.substack.com/",
      "durationSeconds": 4275,
      "episodeNumber": 16,
      "episodeUrl": "https://podcasters.spotify.com/pod/show/nerd-snipe/episodes/We-Tested-GPT-5-6-Sol-Early-e3l97fi",
      "guid": "97e35783-7dca-43b1-a73f-ceafc4e228e0",
      "imageUrl": "https://d3t3ozftmdmh3i.cloudfront.net/staging/podcast_uploaded_nologo/45723160/45723160-1778025894373-b9ff7fbeab87d.jpg",
      "mentions": [],
      "metrics": {
        "firstMentionMs": null,
        "mentionCount": 0,
        "mentionsPerHour": 0.0
      },
      "publishedAt": "2026-07-09T18:11:26Z",
      "review": {
        "completedAt": "2026-07-13T15:04:53Z",
        "evidenceSummary": {
          "acceptedCount": 0,
          "candidateCount": 1,
          "corroboratedAcceptedCount": 0,
          "duplicateCount": 0,
          "rejectedCount": 1,
          "singleSourceAcceptedCount": 0
        },
        "method": "automated-transcript-consensus",
        "policyVersion": "1.0.0",
        "status": "complete",
        "transcriptionConfigHash": "2fe7ae9c053232f9b3170ede1cfd3edf26ea92809e6371dfabca62900fd31716",
        "transcriptionModel": "mlx-community/whisper-large-v3-turbo"
      },
      "seasonNumber": 1,
      "slug": "16-we-tested-gpt-5-6-sol-early",
      "title": "We Tested GPT 5.6 Sol Early",
      "youtube": {
        "captionSource": "youtube-automatic:en-orig",
        "matchStatus": "automatic",
        "videoId": "sQ07OcRzMqo",
        "watchUrl": "https://www.youtube.com/watch?v=sQ07OcRzMqo"
      }
    },
    {
      "audio": {
        "analyzedBytes": 73788603,
        "declaredBytes": 73788603,
        "enclosureUrl": "https://anchor.fm/s/1112097e0/podcast/play/122539318/https%3A%2F%2Fd3ctxlq1ktw2nl.cloudfront.net%2Fstaging%2F2026-6-8%2F427568061-44100-2-5c4dfbe430b1e.mp3",
        "sha256": "8c34960e5d25b1326e13594301e2d1c5164a2f93ad3bfe1b217445e1be0fcf41"
      },
      "description": "Fable was supposed to give us 14 days and instead we got 3 before the export ban. Now it's back at half the rate limits. Also, we break down why AI-generated Claude Code skills fall apart, what actually triggers Fable-to-Opus rerouting, the Mythos export-control timeline, and whether GLM 5.2 can really touch Sonnet 5. Thank you to PostHog for sponsoring today's episode! PostHog, all in one suite of product tools: ⁠https://nerdsnipe.link/posthog Sources available on our Substack: https://nerdsnipe.substack.com/",
      "durationSeconds": 4611,
      "episodeNumber": 15,
      "episodeUrl": "https://podcasters.spotify.com/pod/show/nerd-snipe/episodes/Fable-Is-Back---kinda-e3lq3rm",
      "guid": "bc26c654-caf2-4571-b69b-449da9046d06",
      "imageUrl": "https://d3t3ozftmdmh3i.cloudfront.net/staging/podcast_uploaded_nologo/45723160/45723160-1778025894373-b9ff7fbeab87d.jpg",
      "mentions": [
        {
          "detectedText": "g stack",
          "endMs": 1107360,
          "id": "d23d7b93753b266672b7",
          "publicContext": "about that in the past with like the g stack stuff and all that Speaking of which gary",
          "reviewConfidence": 1.0,
          "source": "mlx",
          "sources": ["mlx", "youtube"],
          "startMs": 1106900
        },
        {
          "detectedText": "g stack",
          "endMs": 1136640,
          "id": "db74e0e72cc279b22ad0",
          "publicContext": "shirt that says I got ai psychosis from g stack Standing next to the deity himself the creator",
          "reviewConfidence": 1.0,
          "source": "mlx",
          "sources": ["mlx", "youtube"],
          "startMs": 1136100
        },
        {
          "detectedText": "g stack.",
          "endMs": 1139580,
          "id": "641593763d53f80b05e4",
          "publicContext": "next to the deity himself the creator of g stack. I i'm gonna push back a little bit",
          "reviewConfidence": 1.0,
          "source": "mlx",
          "sources": ["mlx", "youtube"],
          "startMs": 1139180
        },
        {
          "detectedText": "g stack",
          "endMs": 4427440,
          "id": "3ea9671738a00edf9562",
          "publicContext": "shirt I am not I will wear the g stack shirt This is your punishment for being sonnet",
          "reviewConfidence": 1.0,
          "source": "mlx",
          "sources": ["mlx", "youtube"],
          "startMs": 4426880
        },
        {
          "detectedText": "g stack",
          "endMs": 4529680,
          "id": "1477c48d50ef2e76245d",
          "publicContext": "imagined I mean like the ai psychosis from g stack t -shirt is pretty bad The g shirt",
          "reviewConfidence": 1.0,
          "source": "mlx",
          "sources": ["mlx", "youtube"],
          "startMs": 4529160
        },
        {
          "detectedText": "g stack",
          "endMs": 4543280,
          "id": "1aa259916da26bc9883f",
          "publicContext": "is the g shirt is unworthy of the g stack Oh, even better it didn't bother aligning it",
          "reviewConfidence": 1.0,
          "source": "mlx",
          "sources": ["mlx", "youtube"],
          "startMs": 4542740
        }
      ],
      "metrics": {
        "firstMentionMs": 1106900,
        "mentionCount": 6,
        "mentionsPerHour": 4.684
      },
      "publishedAt": "2026-07-08T14:17:50Z",
      "review": {
        "completedAt": "2026-07-13T15:04:53Z",
        "evidenceSummary": {
          "acceptedCount": 6,
          "candidateCount": 6,
          "corroboratedAcceptedCount": 6,
          "duplicateCount": 0,
          "rejectedCount": 0,
          "singleSourceAcceptedCount": 0
        },
        "method": "automated-transcript-consensus",
        "policyVersion": "1.0.0",
        "status": "complete",
        "transcriptionConfigHash": "2fe7ae9c053232f9b3170ede1cfd3edf26ea92809e6371dfabca62900fd31716",
        "transcriptionModel": "mlx-community/whisper-large-v3-turbo"
      },
      "seasonNumber": 1,
      "slug": "15-fable-is-back-kinda",
      "title": "Fable Is Back...kinda?",
      "youtube": {
        "captionSource": "youtube-automatic:en-orig",
        "matchStatus": "automatic",
        "videoId": "s6dgBR_02fM",
        "watchUrl": "https://www.youtube.com/watch?v=s6dgBR_02fM"
      }
    },
    {
      "audio": {
        "analyzedBytes": 68692844,
        "declaredBytes": 68692844,
        "enclosureUrl": "https://anchor.fm/s/1112097e0/podcast/play/122195536/https%3A%2F%2Fd3ctxlq1ktw2nl.cloudfront.net%2Fstaging%2F2026-5-30%2F427099907-44100-2-b6a7368fdcddb.mp3",
        "sha256": "398c1dcc1e3f21f5f6edda17a7e09ccf0781aa88baad1b2487d3e1a9144eaf83"
      },
      "description": "A new \"government-approved rollout\" for GPT-5.6 is coming, and it's got us wondering: are we entering the next dark age of AI model access? Additionally, we break down the launch of T3 Code x Grok CLI, Apple's price hikes, the memory supply crunch driving RAM and SSD costs up, a repo-poisoning and AI PR spam wave hitting open source, the GPT-5.6 non-launch, and what frontier model access looks like in a Fable/Mythos-tier world. Thank you to Composio for sponsoring this episode! Composio, connect your agents to everything: https://nerdsnipe.link/composio Sources Available on our Substack: https://nerdsnipe.substack.com/",
      "durationSeconds": 4293,
      "episodeNumber": 14,
      "episodeUrl": "https://podcasters.spotify.com/pod/show/nerd-snipe/episodes/GPT-5-6-is-here--And-none-of-us-can-use-it-e3lfk4g",
      "guid": "f30043f1-367d-4ef6-a474-4cb886b716fc",
      "imageUrl": "https://d3t3ozftmdmh3i.cloudfront.net/staging/podcast_uploaded_nologo/45723160/45723160-1778025894373-b9ff7fbeab87d.jpg",
      "mentions": [
        {
          "detectedText": "G stack",
          "endMs": 1379620,
          "id": "01a0f238debbe6a422b0",
          "publicContext": "into a Legendary repo Like you know The G stack repo And you just see Claude for all",
          "reviewConfidence": 1.0,
          "source": "mlx",
          "sources": ["mlx", "youtube"],
          "startMs": 1378940
        }
      ],
      "metrics": {
        "firstMentionMs": 1378940,
        "mentionCount": 1,
        "mentionsPerHour": 0.839
      },
      "publishedAt": "2026-06-30T22:17:56Z",
      "review": {
        "completedAt": "2026-07-13T15:04:53Z",
        "evidenceSummary": {
          "acceptedCount": 1,
          "candidateCount": 1,
          "corroboratedAcceptedCount": 1,
          "duplicateCount": 0,
          "rejectedCount": 0,
          "singleSourceAcceptedCount": 0
        },
        "method": "automated-transcript-consensus",
        "policyVersion": "1.0.0",
        "status": "complete",
        "transcriptionConfigHash": "2fe7ae9c053232f9b3170ede1cfd3edf26ea92809e6371dfabca62900fd31716",
        "transcriptionModel": "mlx-community/whisper-large-v3-turbo"
      },
      "seasonNumber": 1,
      "slug": "14-gpt-5-6-is-here-and-none-of-us-can-use-it",
      "title": "GPT-5.6 is here! And none of us can use it.",
      "youtube": {